audio_tag,actual_english,class,cleaned_text,class_labels
6,although i m fine,7,although i m fine,greetings
6,i m fit,7,i m fit,greetings
16,good how about yourself,6,good how about yourself,greetback
6,i guess alright,7,i guess alright,greetings
8,okay and i m not interested,9,okay and i m not interested,not_intrested
16,alright  you ,6,alright  you ,greetback
10,i m,10,i m,other
6,i m doing well,7,i m doing well,greetings
10,hi mumbling,10,hi mumbling,other
16,i am fine and you tell,6,i am fine and you tell,greetback
8,oh not interested,9,oh not interested,not_intrested
3,ans  mach,1,ans  mach,answering_machine
8,doing fine but i don t want any insurance or anything,9,doing fine but i don t want any insurance or anything,not_intrested
10,uhh who is this,10,uhh who is this,other
9,chinese chines,13,chinese chines,spanish
5,i think i have had a call from you already today,4,i think i have had a call from you already today,dnc
6,yes good,7,yes good,greetings
7,hello i m doing fine and i m eighty six years old but i said i m too old i m eighty six years old i m eighty six eight six eighty i am eighty six years old well i m too old i m eighty six years old eighty six thankyou bye bye ,5,hello i m doing fine and i m eighty six years old but i said i m too old i m eighty six years old i m eighty six eight six eighty i am eighty six years old well i m too old i m eighty six years old eighty six thankyou bye bye ,dnq
10,lot of senior citizen,10,lot of senior citizen,other
10,i was doing fine until you called,10,i was doing fine until you called,other
5,i m doing fine but i m tired of these phone calls,4,i m doing fine but i m tired of these phone calls,dnc
4,well they re just getting ready to give me a bath now ,3,well they re just getting ready to give me a bath now ,busy
6,hey fantastic,7,hey fantastic,greetings
6,no bad,7,no bad,greetings
6,oh i m doing pretty good,7,oh i m doing pretty good,greetings
13,i am yes and i ve got plenty of finances to bury me i don t need anymore,0,i am yes and i ve got plenty of finances to bury me i don t need anymore,already_insured
5,are you stupid ,4,are you stupid ,dnc
9,i dont speak englis,13,i dont speak englis,spanish
5,i dont know mam i know one thing you people are going crazy,4,i dont know mam i know one thing you people are going crazy,dnc
10,what do you need ,10,what do you need ,other
16,i m fine thank you so you are ,6,i m fine thank you so you are ,greetback
6,i am fine thank you,7,i am fine thank you,greetings
16,i am doing wonderful what about you amy,6,i am doing wonderful what about you amy,greetback
16,doing good how are you,6,doing good how are you,greetback
10,i m in a re hab,10,i m in a re hab,other
16,i m well amy how are you,6,i m well amy how are you,greetback
6,hi i am okay,7,hi i am okay,greetings
15,not very well but help me i get better,12,not very well but help me i get better,sorry_greeting
5,shut up,4,shut up,dnc
2,fine but i dont need anything thank you,8,fine but i dont need anything thank you,negative
1,think so although my wife could do better i think,11,think so although my wife could do better i think,positive
10,have been through long time,10,have been through long time,other
6,we re fine thank you,7,we re fine thank you,greetings
14,i m okay amy  am i talking to a real person ,2,i m okay amy  am i talking to a real person ,bot
8,i m tired of calls from there i have every thing i need and i m not interested,9,i m tired of calls from there i have every thing i need and i m not interested,not_intrested
6,fine thank you,7,fine thank you,greetings
10,you know i can t hear you i m so sorry i haven t got my hearing aid yet,10,you know i can t hear you i m so sorry i haven t got my hearing aid yet,other
5,ohh fucking anny just my ass,4,ohh fucking anny just my ass,dnc
10,well you know how old i am ,10,well you know how old i am ,other
5,i am eighty five and doing fine i have all the insurance i need good bye please take me off your list,4,i am eighty five and doing fine i have all the insurance i need good bye please take me off your list,dnc
5,i thought i told you to get married so you wouldn t bother me,4,i thought i told you to get married so you wouldn t bother me,dnc
10,laughing,10,laughing,other
10,what are you calling with regard to why are you calling,10,what are you calling with regard to why are you calling,other
8,uh i don t want to talk,9,uh i don t want to talk,not_intrested
6,okay what do you wanna know,7,okay what do you wanna know,greetings
10,you re who,10,you re who,other
4,no thank you i m very very busy got to go,3,no thank you i m very very busy got to go,busy
6,doing fine since early in the morning,7,doing fine since early in the morning,greetings
5,stop calling me,4,stop calling me,dnc
2,i don t want this at all thank you,8,i don t want this at all thank you,negative
6,very well   can i speak to operator ,7,very well   can i speak to operator ,greetings
15,i m not doing very well what can i help you with,12,i m not doing very well what can i help you with,sorry_greeting
10,what is this in regard too,10,what is this in regard too,other
14,oh amy you re not even a person,2,oh amy you re not even a person,bot
14,amy are you a robot,2,amy are you a robot,bot
6,better than yesterday but i m good than tomorrow,7,better than yesterday but i m good than tomorrow,greetings
15,weird,12,weird,sorry_greeting
1,absolutely yes,11,absolutely yes,positive
6,hello fine yes ,7,hello fine yes ,greetings
1,of courese,11,of courese,positive
1,i think i am,11,i think i am,positive
6,i m doing great amy,7,i m doing great amy,greetings
6,i m doing fine what is it you want,7,i m doing fine what is it you want,greetings
16,i m alright how are you doing,6,i m alright how are you doing,greetback
4,well i m busy,3,well i m busy,busy
10,i m seventy two,10,i m seventy two,other
6,fine  amy,7,fine  amy,greetings
6,i m fine bye,7,i m fine bye,greetings
5,not good don t be calling anymore,4,not good don t be calling anymore,dnc
10,hm who are you,10,hm who are you,other
15,horrible ,12,horrible ,sorry_greeting
10,amy what are you wearing,10,amy what are you wearing,other
16,just fine how about yourself,6,just fine how about yourself,greetback
16,hi amy i m good how are you,6,hi amy i m good how are you,greetback
5,oh same as i was about twenty minutes ago when you called,4,oh same as i was about twenty minutes ago when you called,dnc
2,no thank you no thank you bye,8,no thank you no thank you bye,negative
16,just fine how are you doing,6,just fine how are you doing,greetback
6,i m great ,7,i m great ,greetings
15,thank you for calling not too well,12,thank you for calling not too well,sorry_greeting
6,mam doing great ,7,mam doing great ,greetings
15,i m not too  good,12,i m not too  good,sorry_greeting
5,this is a business line,4,this is a business line,dnc
10,is this gonna cost me naything,10,is this gonna cost me naything,other
15,i ve been sick how can i help you,12,i ve been sick how can i help you,sorry_greeting
5,hello welcome to domino s can i help you,4,hello welcome to domino s can i help you,dnc
6,i m doing fine thank you,7,i m doing fine thank you,greetings
6,oh i m fine ,7,oh i m fine ,greetings
6,i m fine what s this all about,7,i m fine what s this all about,greetings
10,this is who,10,this is who,other
10,hello ,10,hello ,other
10,i got me simple you got any,10,i got me simple you got any,other
8,okay you called me before i don t need anything from you all,9,okay you called me before i don t need anything from you all,not_intrested
1,sure ,11,sure ,positive
15,i m on my deathbed,12,i m on my deathbed,sorry_greeting
5,amy  you got a bad memory don t you understand we talked yesterday,4,amy  you got a bad memory don t you understand we talked yesterday,dnc
16,pretty good amy how about you,6,pretty good amy how about you,greetback
16,i m alright how are you,6,i m alright how are you,greetback
10,ah you meant to be a ten percent call and i m fine and thank you for that okay,10,ah you meant to be a ten percent call and i m fine and thank you for that okay,other
4,oh i m really really busy i hope you will i d leave you out for the telephone now have a nice day yooung lady bye bye sorry,3,oh i m really really busy i hope you will i d leave you out for the telephone now have a nice day yooung lady bye bye sorry,busy
6, i am good,7, i am good,greetings
8,i don t want talk about it,9,i don t want talk about it,not_intrested
2,whats this about  theres no senior citizen here ,8,whats this about  theres no senior citizen here ,negative
6,hello i m doing pretty good yeah i hear you ,7,hello i m doing pretty good yeah i hear you ,greetings
15,hi amy hi hi not too good amy hi,12,hi amy hi hi not too good amy hi,sorry_greeting
5,i m all sick and tired of hearing you call me please dont call me back,4,i m all sick and tired of hearing you call me please dont call me back,dnc
16,just fine amy how about yourself,6,just fine amy how about yourself,greetback
6,very good,7,very good,greetings
5,i d like to speak to a representative,4,i d like to speak to a representative,dnc
16,i m doing fine how you doing,6,i m doing fine how you doing,greetback
1,mostly,11,mostly,positive
16,i m fine hope you re the same,6,i m fine hope you re the same,greetback
2,i m not capable i m handicapped ,8,i m not capable i m handicapped ,negative
15,not good at all,12,not good at all,sorry_greeting
9,no hablo inglis,13,no hablo inglis,spanish
10,i don t care,10,i don t care,other
10,how can i help you,10,how can i help you,other
6,i am fine where did you say you re from,7,i am fine where did you say you re from,greetings
8,good enough to tell you that i dont wanna hear what you got to sell,9,good enough to tell you that i dont wanna hear what you got to sell,not_intrested
5,quit calling me,4,quit calling me,dnc
6,good how can i help you,7,good how can i help you,greetings
6,yeah i m doing great,7,yeah i m doing great,greetings
15,bad,12,bad,sorry_greeting
16,i m doing good how about you,6,i m doing good how about you,greetback
13,hello i m good i have that already i have that already i have that already,0,hello i m good i have that already i have that already i have that already,already_insured
10,mam don t worry about how i am doing just tell me what do you want,10,mam don t worry about how i am doing just tell me what do you want,other
5,yeah baby what you want baby,4,yeah baby what you want baby,dnc
2,i m not old enough for senior citizen care how did you get my number,8,i m not old enough for senior citizen care how did you get my number,negative
16,how you doing ,6,how you doing ,greetback
6,i m doing okay,7,i m doing okay,greetings
16,i m good amy how are you,6,i m good amy how are you,greetback
5,i m fine do not call again,4,i m fine do not call again,dnc
1,hello okay yeah ,11,hello okay yeah ,positive
16,how are you doing today just fine,6,how are you doing today just fine,greetback
6, am doing god amy what can i do for you,7, am doing god amy what can i do for you,greetings
16,amy i m doing wonderful how are you doing today,6,amy i m doing wonderful how are you doing today,greetback
15,uh bad yesterday,12,uh bad yesterday,sorry_greeting
8,i m doing fine amy but i don t need anything thank you,9,i m doing fine amy but i don t need anything thank you,not_intrested
6,hello,7,hello,greetings
5,please take me off your call list,4,please take me off your call list,dnc
16,how are you doing senior citizen care,6,how are you doing senior citizen care,greetback
16,how are you ,6,how are you ,greetback
6,so far so good,7,so far so good,greetings
6,doing alright today,7,doing alright today,greetings
10,goodbye amy,10,goodbye amy,other
3,ans machine,1,ans machine,answering_machine
6,i am doing well how can i help you ,7,i am doing well how can i help you ,greetings
5,remove me from the list,4,remove me from the list,dnc
6,feel better,7,feel better,greetings
6,oh okay,7,oh okay,greetings
3,answering machine,1,answering machine,answering_machine
6,ah boy i m great,7,ah boy i m great,greetings
4,can you call me a little bit later i m at a hospital right now,3,can you call me a little bit later i m at a hospital right now,busy
15,i m not too good,12,i m not too good,sorry_greeting
10,why do you care,10,why do you care,other
10,never mind,10,never mind,other
6,i m good good as i was yesterday when we spoke,7,i m good good as i was yesterday when we spoke,greetings
4,going work,3,going work,busy
5,will yoou shut the fuck and mumbling,4,will yoou shut the fuck and mumbling,dnc
6,ahh just great,7,ahh just great,greetings
8,i don t buy anything over the phonr,9,i don t buy anything over the phonr,not_intrested
10,now right yeah,10,now right yeah,other
4,busy,3,busy,busy
14,are you a robot,2,are you a robot,bot
16,good andd you,6,good andd you,greetback
10,what am sorry,10,what am sorry,other
10,no answer,10,no answer,other
10,i m dealing with that mikey,10,i m dealing with that mikey,other
5,take me off your list,4,take me off your list,dnc
3,you have reached a non working number ,1,you have reached a non working number ,answering_machine
6,oh god i m fine,7,oh god i m fine,greetings
16,good yourself,6,good yourself,greetback
5,amy are you supposed to call a business this is never construction,4,amy are you supposed to call a business this is never construction,dnc
15,not doing well today,12,not doing well today,sorry_greeting
10,it,10,it,other
10,mumbling ,10,mumbling ,other
2,no are you capable enough of making your own financial decisions,8,no are you capable enough of making your own financial decisions,negative
6,ohh pretty fair for an old lady,7,ohh pretty fair for an old lady,greetings
16,i m doing well how about yourself,6,i m doing well how about yourself,greetback
6,hi im okay mumble too many people order your i don t have a mumbling,7,hi im okay mumble too many people order your i don t have a mumbling,greetings
6,fine what are you selling,7,fine what are you selling,greetings
10,ah ah,10,ah ah,other
15,i m doing fine mam and too bad,12,i m doing fine mam and too bad,sorry_greeting
8,i m fine and i don t need it,9,i m fine and i don t need it,not_intrested
14,hello is this a recording ,2,hello is this a recording ,bot
2,nope i have a power of attorney,8,nope i have a power of attorney,negative
6,i was doing fine,7,i was doing fine,greetings
5,i m doing great  it is a company phone ,4,i m doing great  it is a company phone ,dnc
7,i m just seven years old,5,i m just seven years old,dnq
4,i m with a nurse right now ,3,i m with a nurse right now ,busy
6,good thank you,7,good thank you,greetings
9,are you speaking spanish,13,are you speaking spanish,spanish
15,really bad,12,really bad,sorry_greeting
16,i m okay are you,6,i m okay are you,greetback
6,i m hunky dory,7,i m hunky dory,greetings
6,well i m okay,7,well i m okay,greetings
6,well i m not real good but okay i guess,7,well i m not real good but okay i guess,greetings
16,i m doing fine fine do you calling me so what s up,6,i m doing fine fine do you calling me so what s up,greetback
10,ah who s this,10,ah who s this,other
6,i m doing good,7,i m doing good,greetings
5,quit calling dumb ass why you calling dumb ass,4,quit calling dumb ass why you calling dumb ass,dnc
6,im doing just fine,7,im doing just fine,greetings
10,on my way up to do over,10,on my way up to do over,other
16,good how you doing,6,good how you doing,greetback
6,well i m just fine,7,well i m just fine,greetings
5,why you keep calling me,4,why you keep calling me,dnc
1,okay,11,okay,positive
6,good sometimes,7,good sometimes,greetings
6,alright okay,7,alright okay,greetings
5,quit calling me bitch ,4,quit calling me bitch ,dnc
6,i m doing fine for i get over teach,7,i m doing fine for i get over teach,greetings
10,i am doing fine what do you need and want,10,i am doing fine what do you need and want,other
6,oh i m fine let me turn myy volume up a lil  bit i can barely hear you,7,oh i m fine let me turn myy volume up a lil  bit i can barely hear you,greetings
8,i m fine i dont have medicare and i dont want,9,i m fine i dont have medicare and i dont want,not_intrested
6,mumbling  hello,7,mumbling  hello,greetings
10,gotten better concedent,10,gotten better concedent,other
16,fine thank you how are you,6,fine thank you how are you,greetback
10,hello hi ,10,hello hi ,other
1,i am are you,11,i am are you,positive
16,pretty good how are you,6,pretty good how are you,greetback
10,fine,10,fine,other
15,i m not doing so well leave me alone,12,i m not doing so well leave me alone,sorry_greeting
10,uh huh,10,uh huh,other
10,oh i m just tryna hang in there,10,oh i m just tryna hang in there,other
6,i am okay,7,i am okay,greetings
4,i m doing fine but i m kinda busy what is this,3,i m doing fine but i m kinda busy what is this,busy
16,i am doing great how are you doing today,6,i am doing great how are you doing today,greetback
10,hello,10,hello,other
6,just okay,7,just okay,greetings
5,i am old as fuck,4,i am old as fuck,dnc
10,yeah yeah thank you,10,yeah yeah thank you,other
10,goodbye,10,goodbye,other
6,oh good,7,oh good,greetings
16,good  how are you,6,good  how are you,greetback
6,well thank you amy,7,well thank you amy,greetings
6,oh fine thank you,7,oh fine thank you,greetings
10,what are you selling,10,what are you selling,other
10,i don t live you know how you know am a senior citizen,10,i don t live you know how you know am a senior citizen,other
6,okay so far what do you want,7,okay so far what do you want,greetings
16,how you doing,6,how you doing,greetback
16,oh i m doing very well how are you ,6,oh i m doing very well how are you ,greetback
4,oh i am all the way out for a supper right now,3,oh i am all the way out for a supper right now,busy
16,i am doing good how are you doing,6,i am doing good how are you doing,greetback
4,sorry amy i don t have time today,3,sorry amy i don t have time today,busy
15,oh i m doing terrible i just had a big scar on my head and i taking my prescription from my doctor and the pharmacy is giving me a hard time can you fix that,12,oh i m doing terrible i just had a big scar on my head and i taking my prescription from my doctor and the pharmacy is giving me a hard time can you fix that,sorry_greeting
6,amy i am doing wonderful,7,amy i am doing wonderful,greetings
6,hello ,7,hello ,greetings
6,fine okay amy anyway thank you,7,fine okay amy anyway thank you,greetings
6,just fine thank you,7,just fine thank you,greetings
4,yes but right now get around to go off,3,yes but right now get around to go off,busy
10,we re monitoring this call right now so,10,we re monitoring this call right now so,other
16,doing good anny how are u,6,doing good anny how are u,greetback
16,i m doing good amy how you doing,6,i m doing good amy how you doing,greetback
10,r u on recorded line what i can do for you,10,r u on recorded line what i can do for you,other
5,not interested put me on a do not call list,4,not interested put me on a do not call list,dnc
4,working,3,working,busy
10,what,10,what,other
10,where you from,10,where you from,other
6,fine good,7,fine good,greetings
5,please put on your no call list,4,please put on your no call list,dnc
8,i am not interested,9,i am not interested,not_intrested
16,i m fine and you,6,i m fine and you,greetback
6,i m fine,7,i m fine,greetings
6,hello yes hello i m okay can you talk loud i can t hear you no ,7,hello yes hello i m okay can you talk loud i can t hear you no ,greetings
8,i m fine honey but i have already got everything i can care off and i don t really need any,9,i m fine honey but i have already got everything i can care off and i don t really need any,not_intrested
6,pretty good for a seventeen year old,7,pretty good for a seventeen year old,greetings
10,medicare what,10,medicare what,other
6,good ,7,good ,greetings
5,can i speak with someone ,4,can i speak with someone ,dnc
5,not worth a damn how about you,4,not worth a damn how about you,dnc
5,i d feel quite better if you ll quit fucking calling me,4,i d feel quite better if you ll quit fucking calling me,dnc
10,tell me what you calling for,10,tell me what you calling for,other
6,right,7,right,greetings
15,not very good,12,not very good,sorry_greeting
6,i m doing fine what can i do for you today,7,i m doing fine what can i do for you today,greetings
5,crappy now that you called,4,crappy now that you called,dnc
9,mumbling i don t understand english sorry ,13,mumbling i don t understand english sorry ,spanish
10,ohh i m like usual sitting down reading a book,10,ohh i m like usual sitting down reading a book,other
6,i am doing good amy  thank you,7,i am doing good amy  thank you,greetings
5,quit fucking calling me,4,quit fucking calling me,dnc
6,i m doing fine do you know it s almost nine o clock at night here,7,i m doing fine do you know it s almost nine o clock at night here,greetings
5,same as i was yesterday,4,same as i was yesterday,dnc
15,sorry,12,sorry,sorry_greeting
16,i m doing terrible amy how you doing you have a nice day amy,6,i m doing terrible amy how you doing you have a nice day amy,greetback
6,oh i was doing great until you called,7,oh i was doing great until you called,greetings
10,it is,10,it is,other
13,i m doing well amy but i had several calls from the agency that you work with and i m eighty years old and i already have the life insurance and maybe you better speak time with someone younger and thank you for calling,0,i m doing well amy but i had several calls from the agency that you work with and i m eighty years old and i already have the life insurance and maybe you better speak time with someone younger and thank you for calling,already_insured
6,okay how can i help you,7,okay how can i help you,greetings
6,i m doing alright but owner of the house is not here,7,i m doing alright but owner of the house is not here,greetings
5,you re the fucking computer,4,you re the fucking computer,dnc
10,why me it depends on,10,why me it depends on,other
5,ah don t call me no more good you re recorder and i don t wanna talk no talk just messages,4,ah don t call me no more good you re recorder and i don t wanna talk no talk just messages,dnc
6,doing very well,7,doing very well,greetings
10,i am doing fine  what do you need and want,10,i am doing fine  what do you need and want,other
13,hello i m doing all right nope i don t i already got it okay ,0,hello i m doing all right nope i don t i already got it okay ,already_insured
6,okay can i take a message,7,okay can i take a message,greetings
5,i be doing good amy if you don t rest your recorded scammers quit calling,4,i be doing good amy if you don t rest your recorded scammers quit calling,dnc
10,noise,10,noise,other
16,uh okay how are you,6,uh okay how are you,greetback
1,yeah what is it,11,yeah what is it,positive
10,when you call somebody you atleast talk to them,10,when you call somebody you atleast talk to them,other
4,hold on amy i m in the bunch of people and i can t hear what you say excuse me i also have to go out of here okay hold on,3,hold on amy i m in the bunch of people and i can t hear what you say excuse me i also have to go out of here okay hold on,busy
6,i m doing fine what is it that you want,7,i m doing fine what is it that you want,greetings
9,i m not saying english i am saying spanish,13,i m not saying english i am saying spanish,spanish
6,i m good fine,7,i m good fine,greetings
16,i m just fine and you,6,i m just fine and you,greetback
5,mumbling hello all right but i don t need no insurance no nothing please do not call  ,4,mumbling hello all right but i don t need no insurance no nothing please do not call  ,dnc
15,not doing so good,12,not doing so good,sorry_greeting
10,you with what,10,you with what,other
6,good very good,7,good very good,greetings
2,fair but i am not a senior,8,fair but i am not a senior,negative
15,not too well today,12,not too well today,sorry_greeting
6,fine,7,fine,greetings
6,oh pretty good,7,oh pretty good,greetings
6,hello i m okay ,7,hello i m okay ,greetings
10,how can be that sound for,10,how can be that sound for,other
1,yeah amy,11,yeah amy,positive
6,i m good i m good,7,i m good i m good,greetings
10,what s your last name amy,10,what s your last name amy,other
5,i m only fifty two please put me on the do not call list,4,i m only fifty two please put me on the do not call list,dnc
5,please not call back,4,please not call back,dnc
5,block call,4,block call,dnc
10,i i,10,i i,other
10,how did you get my number,10,how did you get my number,other
5,fine you already called here too many times  can t remember,4,fine you already called here too many times  can t remember,dnc
5,mam i already had five calls from american senior care same question,4,mam i already had five calls from american senior care same question,dnc
5,yes i m still growing old and i don t like you calling me thankyou,4,yes i m still growing old and i don t like you calling me thankyou,dnc
13,i am good day how about you and i have all the insurance honey but appreciate your call thank you,0,i am good day how about you and i have all the insurance honey but appreciate your call thank you,already_insured
10,oh my god this is a mumble person,10,oh my god this is a mumble person,other
10,what i can do for you anny,10,what i can do for you anny,other
6,oh i m good yes i m good,7,oh i m good yes i m good,greetings
5,i m good why are you calling me this time at night,4,i m good why are you calling me this time at night,dnc
8,hello yes i told you not to call here i don t want it bye bye,9,hello yes i told you not to call here i don t want it bye bye,not_intrested
6,fine what can i do for you today,7,fine what can i do for you today,greetings
5,please take this number out of list,4,please take this number out of list,dnc
16,alright how are you,6,alright how are you,greetback
14,amy are you a robot or a recording ,2,amy are you a robot or a recording ,bot
6,i ve been better ,7,i ve been better ,greetings
6,i m fine amy are you a senior citizen,7,i m fine amy are you a senior citizen,greetings
