audio_tag,actual_english,class,cleaned_text,class_labels
15,not good not feeling good,12,not good not feeling good,sorry_greeting
15,not that great,12,not that great,sorry_greeting
16,good and how are you doing,6,good and how are you doing,greetback
9,not english,13,not english,spanish
8,okay i don t need anything though,9,okay i don t need anything though,not_intrested
6,i m doing fit amy,7,i m doing fit amy,greetings
15,i no good,12,i no good,sorry_greeting
10,yes i can hear you,10,yes i can hear you,other
10,honey you got rational yesterday mumbling,10,honey you got rational yesterday mumbling,other
2,yeah i am doing fine i am not old enough to get medicares,8,yeah i am doing fine i am not old enough to get medicares,negative
5,i m too young for this please stop calling me,4,i m too young for this please stop calling me,dnc
5,hello take me off your call list ,4,hello take me off your call list ,dnc
16,i m fine how about you,6,i m fine how about you,greetback
16,i m doing fine what s up ,6,i m doing fine what s up ,greetback
10,our apartment,10,our apartment,other
6,hello this is ross,7,hello this is ross,greetings
6,i m good who do you want to speak to,7,i m good who do you want to speak to,greetings
16,i m okay how are you,6,i m okay how are you,greetback
10,amy amy you re full of it amy,10,amy amy you re full of it amy,other
1,i am i live by myself and i,11,i am i live by myself and i,positive
1,yeah yeah yeah i can i can,11,yeah yeah yeah i can i can,positive
5,i don t care at all what you got to say please don t say again,4,i don t care at all what you got to say please don t say again,dnc
8,hello you ve already called me today i m not interested ,9,hello you ve already called me today i m not interested ,not_intrested
6,all fine,7,all fine,greetings
6,well i ve got somebody here working on the tv so i guess we re okay,7,well i ve got somebody here working on the tv so i guess we re okay,greetings
16,i m alright and you,6,i m alright and you,greetback
6,good thank you,7,good thank you,greetings
16,fine what s up amy,6,fine what s up amy,greetback
15,not well ,12,not well ,sorry_greeting
16,alright how you doing,6,alright how you doing,greetback
6,alright yeah,7,alright yeah,greetings
6,i m doing pretty good but i can hardly hear you,7,i m doing pretty good but i can hardly hear you,greetings
6,i m fine ,7,i m fine ,greetings
16,no good how are you doing,6,no good how are you doing,greetback
5,i am doing thank you for asking but you know what you re the third person calling thank you so much i ve been so kind you have a present day goodbye,4,i am doing thank you for asking but you know what you re the third person calling thank you so much i ve been so kind you have a present day goodbye,dnc
6,i m just fine thank you,7,i m just fine thank you,greetings
10,who is this,10,who is this,other
6,i guess i m doing alright,7,i guess i m doing alright,greetings
10,i m doing,10,i m doing,other
13,my son he s the doctor so he know mumbling take care of it,0,my son he s the doctor so he know mumbling take care of it,already_insured
6,im doing fine,7,im doing fine,greetings
8,i m fine thank you but i m not interested,9,i m fine thank you but i m not interested,not_intrested
5,oh my god stop calling this number,4,oh my god stop calling this number,dnc
6,i m fine pleasure,7,i m fine pleasure,greetings
4,i have to take a call from my doctor amy,3,i have to take a call from my doctor amy,busy
6,alright,7,alright,greetings
2,i m fine but i dont need anything,8,i m fine but i dont need anything,negative
16,i am doing good how are you,6,i am doing good how are you,greetback
10,mumble,10,mumble,other
4,i am getting ready for my meeting what can i help you with,3,i am getting ready for my meeting what can i help you with,busy
5,i had about four of these calls today and i m getting sick of it i dont need that  i got a doctor dont need to go through anything else,4,i had about four of these calls today and i m getting sick of it i dont need that  i got a doctor dont need to go through anything else,dnc
10,i m here dying,10,i m here dying,other
15,well i am sick what is your problem,12,well i am sick what is your problem,sorry_greeting
6,i m doing good i m better than ,7,i m doing good i m better than ,greetings
5,i am looking for a lover,4,i am looking for a lover,dnc
8,thank you very much amy i am not interested in any features funeral or,9,thank you very much amy i am not interested in any features funeral or,not_intrested
15,oh bad bad bad and you,12,oh bad bad bad and you,sorry_greeting
6,well i m still alright i m ninety eight,7,well i m still alright i m ninety eight,greetings
15,i m so tired y all calling me,12,i m so tired y all calling me,sorry_greeting
6,hi amy with american senior citizen care i m doing fine,7,hi amy with american senior citizen care i m doing fine,greetings
5,please take my number off your list i m not a senior citizen yet,4,please take my number off your list i m not a senior citizen yet,dnc
16,i m just great how re you doing,6,i m just great how re you doing,greetback
6,almost perfect,7,almost perfect,greetings
5,just fine until you called,4,just fine until you called,dnc
6,have a good day,7,have a good day,greetings
5,hell  what is this,4,hell  what is this,dnc
1,good yes yes yes okay ,11,good yes yes yes okay ,positive
15,not too well what can i do for you,12,not too well what can i do for you,sorry_greeting
15,well i m a senior citizen and i m not doing that great,12,well i m a senior citizen and i m not doing that great,sorry_greeting
5,go away,4,go away,dnc
5,well same as the last time you called,4,well same as the last time you called,dnc
6,well i m doing okay what can i do for you,7,well i m doing okay what can i do for you,greetings
6,no i m doing okay,7,no i m doing okay,greetings
8,hang up,9,hang up,not_intrested
16,i m doing well thank you and yourself,6,i m doing well thank you and yourself,greetback
6,i m doing great,7,i m doing great,greetings
5,amy you called me several times i m too old for you,4,amy you called me several times i m too old for you,dnc
8,i m doing alright but i m not buying anything you re selling,9,i m doing alright but i m not buying anything you re selling,not_intrested
15,they are burried,12,they are burried,sorry_greeting
15,not good,12,not good,sorry_greeting
5,no calling please,4,no calling please,dnc
6,i m fine don t call,7,i m fine don t call,greetings
1,hello yeah yeah ,11,hello yeah yeah ,positive
6,good,7,good,greetings
10,what do you want ,10,what do you want ,other
6,i m doing good ,7,i m doing good ,greetings
10,this call,10,this call,other
13,i m fine mam i get a lot of these calls and i m military so i dont need the medicare services,0,i m fine mam i get a lot of these calls and i m military so i dont need the medicare services,already_insured
6,doing well,7,doing well,greetings
15,not to good anny,12,not to good anny,sorry_greeting
5,u know anny i m sick u calling me every day good bye,4,u know anny i m sick u calling me every day good bye,dnc
16,doing fine what about you,6,doing fine what about you,greetback
5,don t call me please,4,don t call me please,dnc
6,good okay,7,good okay,greetings
6,hi i m alright,7,hi i m alright,greetings
16,fine what about you,6,fine what about you,greetback
4,pretty busy,3,pretty busy,busy
8,oh i dont need anything mam okay have a blessed day,9,oh i dont need anything mam okay have a blessed day,not_intrested
6,well i guess alright,7,well i guess alright,greetings
16,i m good amy how you doing today,6,i m good amy how you doing today,greetback
6,i feel good ,7,i feel good ,greetings
6,oh i was doing fine,7,oh i was doing fine,greetings
15,thank you for calling not well,12,thank you for calling not well,sorry_greeting
6,a bit fine,7,a bit fine,greetings
6,uh okay ,7,uh okay ,greetings
10,oh spam risk,10,oh spam risk,other
5,i m good i think i talked to you in the morning,4,i m good i think i talked to you in the morning,dnc
16,oh i m so good amy how is your life going,6,oh i m so good amy how is your life going,greetback
5,hey you called me yesterday i m not interested,4,hey you called me yesterday i m not interested,dnc
10,okay but he s not here right now,10,okay but he s not here right now,other
15,terrible  mumbling,12,terrible  mumbling,sorry_greeting
4,well i m busy,3,well i m busy,busy
16,fine how about you,6,fine how about you,greetback
8,i don t need any citizen care,9,i don t need any citizen care,not_intrested
6,oh not too bad,7,oh not too bad,greetings
6,oh hang on i m fine,7,oh hang on i m fine,greetings
5,yeah this is only the third or fourth call i ve had from you guys today ,4,yeah this is only the third or fourth call i ve had from you guys today ,dnc
16,just fine how are you,6,just fine how are you,greetback
6,o fine,7,o fine,greetings
4,i m really busy right now can you call back,3,i m really busy right now can you call back,busy
1,yeah ofcourse,11,yeah ofcourse,positive
6,i am doing good,7,i am doing good,greetings
6,very well,7,very well,greetings
6,oh could be better,7,oh could be better,greetings
10,i m eleven,10,i m eleven,other
6,i was doing alright,7,i was doing alright,greetings
10,i was asleep,10,i was asleep,other
10,what you need,10,what you need,other
6,i m happy,7,i m happy,greetings
5,its a business,4,its a business,dnc
6,yes good how can i help you ,7,yes good how can i help you ,greetings
5,little late for this stop playing it its almost nine  o  clock and you re doing a robo call get the hell off my phonne,4,little late for this stop playing it its almost nine  o  clock and you re doing a robo call get the hell off my phonne,dnc
6,i m doing fine how may i help you,7,i m doing fine how may i help you,greetings
16,i m doing fine how you doing,6,i m doing fine how you doing,greetback
6,i m fine for a ninety years old ,7,i m fine for a ninety years old ,greetings
6,im doing good,7,im doing good,greetings
10,hello yes mumbling say it again,10,hello yes mumbling say it again,other
5,oh i m damn here perfect how are you,4,oh i m damn here perfect how are you,dnc
10,oh i dont think i called you,10,oh i dont think i called you,other
9,no inglis,13,no inglis,spanish
15,rotten,12,rotten,sorry_greeting
5,i m just fine please do not call me back again,4,i m just fine please do not call me back again,dnc
16,i m doing just fine how about you,6,i m doing just fine how about you,greetback
6,doing fine what do you wanna know,7,doing fine what do you wanna know,greetings
6,hi i m good,7,hi i m good,greetings
10,hello i could hear you can you hear me,10,hello i could hear you can you hear me,other
5,shitty,4,shitty,dnc
10,twenty five,10,twenty five,other
16,i am doing okay you,6,i am doing okay you,greetback
10,new,10,new,other
6,good afternoon this is jack this is jack,7,good afternoon this is jack this is jack,greetings
10,do you know what time it is,10,do you know what time it is,other
16,mam i m doing great  how are you doing today ,6,mam i m doing great  how are you doing today ,greetback
9,do you speak spanish,13,do you speak spanish,spanish
1,i am i,11,i am i,positive
16,hello amy i m doing great amy how are you doing today,6,hello amy i m doing great amy how are you doing today,greetback
6,i am good,7,i am good,greetings
10,hello,10,hello,other
6,i m fine,7,i m fine,greetings
2,no thank you,8,no thank you,negative
5,okay that s the third time you ve called me today ,4,okay that s the third time you ve called me today ,dnc
10,what s on your mind,10,what s on your mind,other
6,hello um okay i made it to another day nope thankyou for calling ,7,hello um okay i made it to another day nope thankyou for calling ,greetings
6,i m doing just dandy,7,i m doing just dandy,greetings
10,i hear you,10,i hear you,other
16,right right doing good how about you,6,right right doing good how about you,greetback
14,amy the robot,2,amy the robot,bot
10,what s up yeah yeah although you re about it,10,what s up yeah yeah although you re about it,other
10,do you really care,10,do you really care,other
2,i don t know but i have talked to you three to four times in my house in the last week ,8,i don t know but i have talked to you three to four times in my house in the last week ,negative
10,well you know how old i am  ,10,well you know how old i am  ,other
6,fine and you,7,fine and you,greetings
15,not feeling so good,12,not feeling so good,sorry_greeting
9,me speak spanish,13,me speak spanish,spanish
10,i am a senior citizen,10,i am a senior citizen,other
4,i m driving right now how can i help you,3,i m driving right now how can i help you,busy
15,not good  wanna be left alone,12,not good  wanna be left alone,sorry_greeting
16,i m doing alright and you,6,i m doing alright and you,greetback
15,not too well,12,not too well,sorry_greeting
10,most days,10,most days,other
10,yeah i m here ,10,yeah i m here ,other
5,yeah sucking dicks and eating out chicks how are you,4,yeah sucking dicks and eating out chicks how are you,dnc
5,oh you do mumble fucking monkeys,4,oh you do mumble fucking monkeys,dnc
2,i m okay but i dont need no benefit,8,i m okay but i dont need no benefit,negative
16,i m doing fine darling how about you,6,i m doing fine darling how about you,greetback
1,yeah ,11,yeah ,positive
16,i m okay how you doing,6,i m okay how you doing,greetback
6,pretty good thank you,7,pretty good thank you,greetings
10,seriously,10,seriously,other
10,who was who,10,who was who,other
10,jargon,10,jargon,other
5,amy fuck that,4,amy fuck that,dnc
16,how are you doing ,6,how are you doing ,greetback
10,who are you,10,who are you,other
15,i am not good,12,i am not good,sorry_greeting
6,hello yes,7,hello yes,greetings
16,doing well how are you,6,doing well how are you,greetback
10,this was a long work,10,this was a long work,other
6,i m doing fine thankyou,7,i m doing fine thankyou,greetings
6,i was doing  good what do you selling what you wanna bum from me have a nice day ,7,i was doing  good what do you selling what you wanna bum from me have a nice day ,greetings
5,i d be better if you quit calling me five seven times a day,4,i d be better if you quit calling me five seven times a day,dnc
6,we re doing fine wish me goodluck seeing you soon sunday,7,we re doing fine wish me goodluck seeing you soon sunday,greetings
10,ohh resting,10,ohh resting,other
1,yes ,11,yes ,positive
6,i m alright talk to,7,i m alright talk to,greetings
5,hey you called me about 5 times a day so,4,hey you called me about 5 times a day so,dnc
6,i m fine what are you selling ,7,i m fine what are you selling ,greetings
10,what s that,10,what s that,other
1,i can,11,i can,positive
16,good amy how are you,6,good amy how are you,greetback
6,i m doing good why do you call,7,i m doing good why do you call,greetings
16,i dont know how are you,6,i dont know how are you,greetback
10,ah,10,ah,other
5,what s it all about you keep calling me,4,what s it all about you keep calling me,dnc
6,hello oh just wonderful kill me,7,hello oh just wonderful kill me,greetings
10,mumble,10,mumble,other
13,i m not interested i own the va take me up the call list,0,i m not interested i own the va take me up the call list,already_insured
16,i m fine how are you amy,6,i m fine how are you amy,greetback
15,not so good horrible,12,not so good horrible,sorry_greeting
6,i m alright i m just fine,7,i m alright i m just fine,greetings
2,before you pretty good,8,before you pretty good,negative
6,i m doing just fine just great,7,i m doing just fine just great,greetings
15,not good amy,12,not good amy,sorry_greeting
10,what do you gotta call at this time goodbye,10,what do you gotta call at this time goodbye,other
10,call disconnect,10,call disconnect,other
6,well okay,7,well okay,greetings
2,mumbling  but i can t hear you,8,mumbling  but i can t hear you,negative
5,oh my god i m done with you guys quit calling me,4,oh my god i m done with you guys quit calling me,dnc
10,what s your name,10,what s your name,other
2,i don t want an insurance,8,i don t want an insurance,negative
10,american senior citizens care i got a problem,10,american senior citizens care i got a problem,other
15,not feeling well how about you,12,not feeling well how about you,sorry_greeting
10,i just woke up mumbling,10,i just woke up mumbling,other
5,i m fucking tired,4,i m fucking tired,dnc
16,oh i m not so good how are you,6,oh i m not so good how are you,greetback
5,hi amy hi ok i talked to you before,4,hi amy hi ok i talked to you before,dnc
15,mam i m doing bad,12,mam i m doing bad,sorry_greeting
15,i m doing just my age mumble i dont have a good days anymore,12,i m doing just my age mumble i dont have a good days anymore,sorry_greeting
5,take me off your list please,4,take me off your list please,dnc
6,well alright,7,well alright,greetings
10,hang up,10,hang up,other
6,i m doing great ,7,i m doing great ,greetings
1,yeah ,11,yeah ,positive
15,i m not okay,12,i m not okay,sorry_greeting
16,oh no good how are you,6,oh no good how are you,greetback
10,i m really old and tired i wish i had some some sort of insurance,10,i m really old and tired i wish i had some some sort of insurance,other
6,oh i am good ,7,oh i am good ,greetings
6,i am fine hello hello,7,i am fine hello hello,greetings
6,i m doing really fine for eighty five years old,7,i m doing really fine for eighty five years old,greetings
10,same here,10,same here,other
6,i m very well thank you ,7,i m very well thank you ,greetings
16,i m doing good you,6,i m doing good you,greetback
6,pretty well,7,pretty well,greetings
5,i m doing fine don t call me no more,4,i m doing fine don t call me no more,dnc
7,i m off senior citizen,5,i m off senior citizen,dnq
16,not much well today lately how are you ,6,not much well today lately how are you ,greetback
6,well,7,well,greetings
14,you re a robot aren t yeah ,2,you re a robot aren t yeah ,bot
6,okay thank you,7,okay thank you,greetings
16,i m fine whats up,6,i m fine whats up,greetback
16,i m very good you,6,i m very good you,greetback
5,i m great don t fucking calling me anymore,4,i m great don t fucking calling me anymore,dnc
6,well i am fine,7,well i am fine,greetings
1,yes,11,yes,positive
10,what am i speaking with,10,what am i speaking with,other
10,um ah yes thank you,10,um ah yes thank you,other
6,i am doing fine thank you,7,i am doing fine thank you,greetings
6,i m good what can i do for you,7,i m good what can i do for you,greetings
6,good but is it important ,7,good but is it important ,greetings
6,yeah i m doing alright,7,yeah i m doing alright,greetings
5,no lemme talk to your fucking boss,4,no lemme talk to your fucking boss,dnc
15,miserable,12,miserable,sorry_greeting
8,but i m not interested in buying anything,9,but i m not interested in buying anything,not_intrested
10,uhh,10,uhh,other
5,please dont call,4,please dont call,dnc
5,amy you don t have to call this number anymore,4,amy you don t have to call this number anymore,dnc
6,fine fine what can i do for you,7,fine fine what can i do for you,greetings
5,bloody you called before please don t call again bye ,4,bloody you called before please don t call again bye ,dnc
10,call disconnected e,10,call disconnected e,other
5,we re not interested don t call ever back we re not interested ,4,we re not interested don t call ever back we re not interested ,dnc
14,amy are you real or are you a machine,2,amy are you real or are you a machine,bot
15,hello may i help you not too good ,12,hello may i help you not too good ,sorry_greeting
5,not worth a shit,4,not worth a shit,dnc
6,pretty good i dont need no help i am good,7,pretty good i dont need no help i am good,greetings
8,fine i m not interested,9,fine i m not interested,not_intrested
10,hello mumbling,10,hello mumbling,other
16,i m pretty good how are you,6,i m pretty good how are you,greetback
16,i m okay amy how you doing,6,i m okay amy how you doing,greetback
10,i m not a senior citizen yet i m only fifty six years of age and i m still working,10,i m not a senior citizen yet i m only fifty six years of age and i m still working,other
16,amy i am fine hope you re doing too,6,amy i am fine hope you re doing too,greetback
8,i m fine but i m not interested in this call mam,9,i m fine but i m not interested in this call mam,not_intrested
5,i want you to remove us from your call,4,i want you to remove us from your call,dnc
6,ohh pretty good,7,ohh pretty good,greetings
16,mumbling  how about yourself,6,mumbling  how about yourself,greetback
16,well and you,6,well and you,greetback
16,i m good how you doing,6,i m good how you doing,greetback
6,i m great amy,7,i m great amy,greetings
16,i m okay how about yourself,6,i m okay how about yourself,greetback
8,mam i am sorry but i am not interested thank you,9,mam i am sorry but i am not interested thank you,not_intrested
10,what do you want ,10,what do you want ,other
6,pretty  good,7,pretty  good,greetings
5,i m military,4,i m military,dnc
16,i am doing are you,6,i am doing are you,greetback
5,don t call no more,4,don t call no more,dnc
6,i m doing fine what you need,7,i m doing fine what you need,greetings
10,beg your pardon,10,beg your pardon,other
5,i m alright this is john good from sherrifs department what can i do for you ,4,i m alright this is john good from sherrifs department what can i do for you ,dnc
6,alright  pretty good,7,alright  pretty good,greetings
8,i am doing fine and i don t need anything,9,i am doing fine and i don t need anything,not_intrested
10,fine until you called goodbye,10,fine until you called goodbye,other
6,i m good amy what do you want,7,i m good amy what do you want,greetings
10,what do you mean,10,what do you mean,other
10,hi pretty,10,hi pretty,other
6,i am fabulous,7,i am fabulous,greetings
1,yeah i think,11,yeah i think,positive
6,i m doing pretty good but i m too young to get it,7,i m doing pretty good but i m too young to get it,greetings
5,yeah amy quit calling my damn phone mumbling you keep calling my phone from different numbers have a good day ,4,yeah amy quit calling my damn phone mumbling you keep calling my phone from different numbers have a good day ,dnc
16,great how are you amy,6,great how are you amy,greetback
6,good can you hold on,7,good can you hold on,greetings
10,still in the bed,10,still in the bed,other
10,i am ninety years old and upset,10,i am ninety years old and upset,other
1,ahan,11,ahan,positive
10,what are you callig with regard to,10,what are you callig with regard to,other
15,lazy,12,lazy,sorry_greeting
6,i m fine ,7,i m fine ,greetings
8,i m doing good thank you but i am not interested okay,9,i m doing good thank you but i am not interested okay,not_intrested
6,yeah i m fine,7,yeah i m fine,greetings
6,i am doing pretty good,7,i am doing pretty good,greetings
6,i am doing great ,7,i am doing great ,greetings
4,i am in hospital,3,i am in hospital,busy
5,well i was doing great until i ve a fake and i was feeling huh  ,4,well i was doing great until i ve a fake and i was feeling huh  ,dnc
15,i died,12,i died,sorry_greeting
6,thank you for calling have a good day bye,7,thank you for calling have a good day bye,greetings
6,very good thank you what do you need,7,very good thank you what do you need,greetings
6,uh good good now how can i help you,7,uh good good now how can i help you,greetings
6,i m okay what do you want ,7,i m okay what do you want ,greetings
5,just fine i ll do better if you just quit calling here no more calls please goodbye,4,just fine i ll do better if you just quit calling here no more calls please goodbye,dnc
6,i m fine what do you wanna sell,7,i m fine what do you wanna sell,greetings
6,pretty good mam i m okay,7,pretty good mam i m okay,greetings
6,hey i m alright,7,hey i m alright,greetings
5,amy  will you suck my cock,4,amy  will you suck my cock,dnc
6,pretty good amy what state is this for,7,pretty good amy what state is this for,greetings
6,i m doing fine someone called me the other day,7,i m doing fine someone called me the other day,greetings
6,oh i m doing well,7,oh i m doing well,greetings
16,i m doing alright how you doing,6,i m doing alright how you doing,greetback
10,thank you yes go ahead,10,thank you yes go ahead,other
5,i m not a senior citizen you can take my name off your list please,4,i m not a senior citizen you can take my name off your list please,dnc
6,doing fine so far,7,doing fine so far,greetings
10,what are you selling ,10,what are you selling ,other
16,fine you say,6,fine you say,greetback
5,amy i dont need anything can you leave me alone please,4,amy i dont need anything can you leave me alone please,dnc
6,reasonable,7,reasonable,greetings
6,i m alright i aint call nobody but i m alright,7,i m alright i aint call nobody but i m alright,greetings
5,i m doing good i m taking a shit,4,i m doing good i m taking a shit,dnc
6,hello hello,7,hello hello,greetings
10,who is this ,10,who is this ,other
4,started the gaming,3,started the gaming,busy
10,what is this senior citizens care,10,what is this senior citizens care,other
2,not too good,8,not too good,negative
10,what you need amy,10,what you need amy,other
4,i m working what do you need ,3,i m working what do you need ,busy
6,hello fine hello yes yes yes yes ,7,hello fine hello yes yes yes yes ,greetings
6,i am doing alright it  raining,7,i am doing alright it  raining,greetings
6,i m doing wonderful for an old man,7,i m doing wonderful for an old man,greetings
2,i don t really mumble,8,i don t really mumble,negative
5,don t call it hey i don t know y,4,don t call it hey i don t know y,dnc
14,amy you re a computer why are you even calling me,2,amy you re a computer why are you even calling me,bot
2,hello no thankyou ,8,hello no thankyou ,negative
10,how can i help you,10,how can i help you,other
6,i am doing alright its for me i am doing alright,7,i am doing alright its for me i am doing alright,greetings
16,fine how are you,6,fine how are you,greetback
10,i m doing  thank you,10,i m doing  thank you,other
6,hello yeah i m doing good bye ,7,hello yeah i m doing good bye ,greetings
